{
  "$schema": "https://json-schema.org/draft/2020-12/schema",
  "title": "requirements",
  "type": "object",
  "properties": {
    "project_name": {
      "type": "string"
    },
    "business_goals": {
      "type": "array",
      "items": {
        "type": "string"
      }
    },
    "in_scope": {
      "type": "array",
      "items": {
        "type": "string"
      }
    },
    "out_of_scope": {
      "type": "array",
      "items": {
        "type": "string"
      }
    },
    "stakeholders": {
      "type": "array",
      "items": {
        "type": "string"
      }
    },
    "constraints": {
      "type": "array",
      "items": {
        "type": "string"
      }
    },
    "assumptions": {
      "type": "array",
      "items": {
        "type": "string"
      }
    },
    "interfaces": {
      "type": "array",
      "items": {
        "type": "string"
      }
    },
    "dependencies": {
      "type": "array",
      "items": {
        "type": "string"
      }
    },
    "acceptance_criteria": {
      "type": "array",
      "items": {
        "type": "string"
      }
    },
    "non_functional": {
      "type": "object",
      "properties": {
        "performance": {
          "type": "string"
        },
        "availability": {
          "type": "string"
        },
        "security": {
          "type": "string"
        },
        "privacy": {
          "type": "string"
        },
        "usability": {
          "type": "string"
        }
      },
      "additionalProperties": false
    },
    "timeline": {
      "type": "string"
    }
  },
  "required": [
    "project_name",
    "business_goals",
    "in_scope",
    "acceptance_criteria"
  ]
}